Sheet: Sheet1
A1: GV | B1: M1 | C1: M2 | D1: M3 | E1: E1 | F1: E2 | G1: E3 | H1: M4 | I1: M5 | J1: E4 | K1: E5 | L1: expected_number_of_class | M1: con_limit | N1: is_full_time | O1: quota
A2: tientd17@fpt.edu.vn | B2: 3 | C2: 5 | D2: 4 | E2: 3 | F2: 5 | G2: 4 | H2: 4 | I2: 5 | J2: 4 | K2: 5 | L2: 9 | M2: 5 | N2: 1 | O2: =IF(RC[-1] = 1,5, 1) -> 5
A3: chilp@fpt.edu.vn | B3: 2 | C3: 5 | D3: 5 | E3: 5 | F3: 5 | G3: 0 | H3: 2 | I3: 5 | J3: 5 | K3: 2 | L3: 8 | M3: 6 | N3: 1 | O3: =IF(RC[-1] = 1,5, 1) -> 5
A4: bantq@fpt.edu.vn | B4: 0 | C4: 5 | D4: 4 | E4: 0 | F4: 5 | G4: 0 | H4: 0 | I4: 5 | J4: 5 | K4: 0 | L4: 5 | M4: 6 | N4: 1 | O4: =IF(RC[-1] = 1,5, 1) -> 5
A5: chungtd6@fpt.edu.vn | B5: 1 | C5: 5 | D5: 5 | E5: 5 | F5: 5 | G5: 5 | H5: 0 | I5: 0 | J5: 0 | K5: 0 | L5: 5 | M5: 5 | N5: 1 | O5: =IF(RC[-1] = 1,5, 1) -> 5
A6: binhnv2@fpt.edu.vn | B6: 5 | C6: 5 | D6: 5 | E6: 5 | F6: 5 | G6: 4 | H6: 5 | I6: 5 | J6: 5 | K6: 5 | L6: 9 | M6: 6 | N6: 1 | O6: =IF(RC[-1] = 1,5, 1) -> 5
A7: huongnt7@fpt.edu.vn | B7: 4 | C7: 4 | D7: 0 | E7: 5 | F7: 5 | G7: 5 | H7: 0 | I7: 0 | J7: 5 | K7: 5 | L7: 7 | M7: 5 | N7: 1 | O7: =IF(RC[-1] = 1,5, 1) -> 5
A8: vunh@fpt.edu.vn | B8: 3 | C8: 4 | D8: 4 | E8: 4 | F8: 4 | G8: 4 | H8: 0 | I8: 0 | J8: 0 | K8: 0 | L8: 5 | M8: 6 | N8: 1 | O8: =IF(RC[-1] = 1,5, 1) -> 5
A9: thamnv5@fpt.edu.vn | B9: 0 | C9: 4 | D9: 4 | E9: 4 | F9: 4 | G9: 4 | H9: 3 | I9: 3 | J9: 3 | K9: 3 | L9: 6 | M9: 5 | N9: 1 | O9: =IF(RC[-1] = 1,5, 1) -> 5
A10: sonnt5@fpt.edu.vn | B10: 5 | C10: 5 | D10: 5 | E10: 5 | F10: 5 | G10: 5 | H10: 5 | I10: 5 | J10: 5 | K10: 5 | L10: 10 | M10: 6 | N10: 1 | O10: =IF(RC[-1] = 1,5, 1) -> 5
A11: anhbn@fpt.edu.vn | B11: 5 | C11: 5 | D11: 5 | E11: 5 | F11: 5 | G11: 5 | H11: 5 | I11: 5 | J11: 5 | K11: 5 | L11: 6 | M11: 6 | N11: 1 | O11: =IF(RC[-1] = 1,5, 1) -> 5
A12: phuonglh17@fpt.edu.vn | B12: 5 | C12: 5 | D12: 5 | E12: 5 | F12: 5 | G12: 5 | H12: 5 | I12: 5 | J12: 5 | K12: 5 | L12: 9 | M12: 6 | N12: 1 | O12: =IF(RC[-1] = 1,5, 1) -> 5
A13: caupd@fpt.edu.vn | B13: 5 | C13: 5 | D13: 5 | E13: 5 | F13: 5 | G13: 5 | H13: 5 | I13: 5 | J13: 5 | K13: 5 | L13: 9 | M13: 6 | N13: 1 | O13: =IF(RC[-1] = 1,5, 1) -> 5
A14: anhnh2@fpt.edu.vn | B14: 5 | C14: 5 | D14: 5 | E14: 5 | F14: 5 | G14: 5 | H14: 5 | I14: 5 | J14: 0 | K14: 0 | L14: 7 | M14: 6 | N14: 1 | O14: =IF(RC[-1] = 1,5, 1) -> 5
A15: hapt27@fpt.edu.vn | B15: 5 | C15: 5 | D15: 5 | E15: 5 | F15: 5 | G15: 5 | H15: 0 | I15: 0 | J15: 0 | K15: 0 | L15: 5 | M15: 6 | N15: 0 | O15: =IF(RC[-1] = 1,5, 1) -> 1
A16: anhttv20@fpt.edu.vn | B16: 0 | C16: 0 | D16: 0 | E16: 0 | F16: 0 | G16: 0 | H16: 5 | I16: 5 | J16: 5 | K16: 5 | L16: 4 | M16: 6 | N16: 0 | O16: =IF(RC[-1] = 1,5, 1) -> 1
A17: khuongpd@fpt.edu.vn | B17: 5 | C17: 5 | D17: 5 | E17: 5 | F17: 5 | G17: 5 | H17: 5 | I17: 5 | J17: 5 | K17: 5 | L17: 10 | M17: 6 | N17: 1 | O17: =IF(RC[-1] = 1,5, 1) -> 5
A18: bangbh@fpt.edu.vn | B18: 0 | C18: 0 | D18: 0 | E18: 0 | F18: 0 | G18: 0 | H18: 5 | I18: 5 | J18: 5 | K18: 5 | L18: 4 | M18: 6 | N18: 0 | O18: =IF(RC[-1] = 1,5, 1) -> 1
A19: CuongL2@fpt.edu.vn | B19: 0 | C19: 0 | D19: 0 | E19: 0 | F19: 0 | G19: 0 | H19: 5 | I19: 5 | J19: 5 | K19: 5 | L19: 4 | M19: 6 | N19: 0 | O19: =IF(RC[-1] = 1,5, 1) -> 1
A20: hungdc@fpt.edu.vn | B20: 5 | C20: 5 | D20: 5 | E20: 0 | F20: 0 | G20: 0 | H20: 5 | I20: 5 | J20: 0 | K20: 0 | L20: 2 | M20: 6 | N20: 0 | O20: =IF(RC[-1] = 1,5, 1) -> 1
A21: ngaDTT22@fpt.edu.vn | B21: 5 | C21: 5 | D21: 5 | E21: 0 | F21: 0 | G21: 0 | H21: 5 | I21: 5 | J21: 0 | K21: 0 | L21: 2 | M21: 6 | N21: 0 | O21: =IF(RC[-1] = 1,5, 1) -> 1
A22: Sonhx@fpt.edu.vn | B22: 0 | C22: 0 | D22: 0 | E22: 0 | F22: 0 | G22: 0 | H22: 5 | I22: 5 | J22: 0 | K22: 0 | L22: 2 | M22: 6 | N22: 0 | O22: =IF(RC[-1] = 1,5, 1) -> 1
A23: ThieuVV2@fpt.edu.vn | B23: 5 | C23: 5 | D23: 5 | E23: 5 | F23: 5 | G23: 5 | H23: 0 | I23: 0 | J23: 0 | K23: 0 | L23: 5 | M23: 6 | N23: 0 | O23: =IF(RC[-1] = 1,5, 1) -> 1
A24: Truongvx5@fpt.edu.vn | B24: 0 | C24: 0 | D24: 0 | E24: 0 | F24: 0 | G24: 0 | H24: 0 | I24: 0 | J24: 5 | K24: 5 | L24: 2 | M24: 6 | N24: 0 | O24: =IF(RC[-1] = 1,5, 1) -> 1
A25: TungHT22@fpt.edu.vn | B25: 0 | C25: 0 | D25: 0 | E25: 0 | F25: 0 | G25: 0 | H25: 5 | I25: 5 | J25: 5 | K25: 5 | L25: 4 | M25: 6 | N25: 0 | O25: =IF(RC[-1] = 1,5, 1) -> 1
A26: KyVK2@fpt.edu.vn | B26: 5 | C26: 5 | D26: 5 | E26: 5 | F26: 5 | G26: 5 | H26: 0 | I26: 0 | J26: 0 | K26: 0 | L26: 5 | M26: 6 | N26: 0 | O26: =IF(RC[-1] = 1,5, 1) -> 1
A27: thuyntb3@fpt.edu.vn | B27: 0 | C27: 0 | D27: 0 | E27: 0 | F27: 0 | G27: 0 | H27: 5 | I27: 5 | J27: 0 | K27: 0 | L27: 2 | M27: 6 | N27: 0 | O27: =IF(RC[-1] = 1,5, 1) -> 1
A28: ToanPT16@fpt.edu.vn | B28: 0 | C28: 0 | D28: 0 | E28: 5 | F28: 5 | G28: 5 | H28: 0 | I28: 0 | J28: 0 | K28: 0 | L28: 3 | M28: 6 | N28: 0 | O28: =IF(RC[-1] = 1,5, 1) -> 1
A29: HaPN@fpt.edu.vn | B29: 0 | C29: 0 | D29: 0 | E29: 0 | F29: 0 | G29: 0 | H29: 5 | I29: 5 | J29: 0 | K29: 0 | L29: 2 | M29: 6 | N29: 0 | O29: =IF(RC[-1] = 1,5, 1) -> 1